{
  "schema_version": 1,
  "seq": 1,
  "state_revision": 1,
  "event_id": "EVT-00000000-0000-0000-0000-000000000001",
  "timestamp": "2026-07-29T00:00:00Z",
  "workflow_id": "WF-00000000-0000-0000-0000-000000000001",
  "task_id": null,
  "run_id": null,
  "actor": "manager-agent",
  "event_type": "WORKFLOW_CREATED",
  "from_status": null,
  "to_status": "CREATED",
  "from_phase": null,
  "to_phase": "INTAKE",
  "task_status_before": null,
  "task_status_after": null,
  "candidate_commit": null,
  "previous_event_hash": "0000000000000000000000000000000000000000000000000000000000000000",
  "payload": {},
  "event_hash": "d42a3dbcacd494ced033f30a4818ca3a4941f8e76e44ce459782ef534dbe15e8"
}
